,score,comment
3635,3.6666666666666665, سعی کنید برندارید باهاشون اذیت میشید.نتتونم ۲ دیقه قطع بشه غیبت و منفی میخورید
3636,6.0, نمراتو دیر وارد کردن.امتحانشونم نسبت به درسی که میدن واقعا سخت گرفتن.دوتا کنفرانسم باید بدید
3637,7.0, این درس پیشنیاز درسی نیست.
3638,4.5, اشکتونو در میاره با تکلیفا و امتحاناش. امتحان وقت کم میده. به زور با نمره‌های پایین پاس کرد بچه‌هایی که فعالیت داشتنو بین مرگ و زادون=»مرگ
3639,3.5, اگه می‌خوایید چیزی یاد بگیرید با ایشون کلاس برندارید:)
3640,10.0, ایشون عالیه! واقعا استاد باسوادی هستن و درسته امتحانشون سخته اما اگه بخونی ۲۰ میشی چون عالی درس میدن
3641,1.3333333333333333, اصلا کلاس برندارید با ایشون..سر کلاس نمیان و تحقیق سخت میخوان...
3642,9.666666666666666, به نظر من استاد خوبي هستن
3643,5.833333333333333, اصلا باهاشون برندارین واقعا خوب نیست کلی کار کلاسی می‌خواد و شفاهی 150 صفحه جزوه میپرسه و عین ۲ ساعت و نیم رو درس میده و هیچی نمیفهمی
3644,9.833333333333334, خیلی استاد گلی هستن
3645,3.0, ایشون با پسرا یکم مشکل داره
3646,9.666666666666666, جزو بهترین اساتید گروه کامپیوتر هستن و بسیار باسواد و با اخلاق؛ ولی به نظرم درس ساختمان داده رو خیلی دیگه تئوری میگن.
3647,9.666666666666666, عاليييي
3648,10.0, در یک کلمه عالیی هم رفتارشون عالیه هم تدریسشون اگ میخواین درست حسابی یاد بگیرین با ایشون بردارین ❤
3649,9.666666666666666, ۸ نمره امتحان کتبی پایان‌ترم هست، ۱۲ نمره مشارکتی که در طول‌ترم در کلاس داشتی و مثبت‌هایی که گرفتی. حضور و پاسخگویی در کلاس خیلی مهمه!
3650,10.0, استاد خیلی خوش‌قلبیه و با دانشجو‌ها مهربونه و اصلا اذیت نمی‌کنه. امتحان پایان‌ترم هم فقط از پی‌دی‌افِ خودشه. حتما باهاش بردارین.
3651,9.166666666666666, استاد بسیار محترم و منصف هستن و اگر فعالیت کلاسی داشته باشید نمره کامل دریافت میکنید نحوه تدریسشان هم مطلوب است
3652,4.166666666666667, اکثرا پاس شدیم ولی در اولویت اول قرار ندید
3653,1.0, اصلا باهاش بردندارید کل ترم تمرین میده هرجلسه ده تا اخر ترم انداخت
3654,7.833333333333333, تدریس و اخلاقش خوب بود تقریبا ،نمره ام دقیقا چرتکه انداخت اصلا  معیاری نداشت با اینکه امتحانشو من مطمئن بودم 18 19 میشم 14 داد
3655,10.0, عالی هستن و حتما باهاشون کلاس بردارین و اطلاعات بالایی دارن
3656,4.333333333333333, آموزش و دانششون کافی نیست برای تدریس این درس تخصصی و اموزش خوبی ندیدن دانشجو ها. ولی استاد بسیار خوش برخوردی هستن
3657,10.0, خیلی مهربونن با دانشجو راه میان، درسو آخر ترم مرور میکنن مهما رو میگن. یه گروه که با هم دوست بودیم همگی۲۰ شدیم. عالیه انتخاب اولتون باشه
3658,2.8333333333333335, استادی بسیارسختگیرهستن نمره ی خوبی نمیده سوالاتش تحلیلی هس وربطی به جزوه و کتاب نداره
3659,10.0, حتما باهاشون بردارین.عالی هستن ایشون
3660,1.8333333333333333, دوتا کتاب 200 صفحه ای باید بخونی شفاهی سوال میپرسه تو کلاس نهاد هم بدی ازش شفاهی میپرسه. برای درس عمومی 2 واحدی خیلی زیاده
3661,8.166666666666666, چند جلسه اول میگه میپرسم ولی اگه جواب ندی کاری نداره بعد از ۳ جلسه اول موضوع میدن به هرکس که پاور درست کنن و ارائه بدن
3662,3.0, اصلا از لحاظ روانی استاد خوبی نیست و نیم نمره هم ارفاق نمیکنه
3663,9.166666666666666, استاد خوبیه در طول ترم یه میان ترم  ۵ نمره ایی میگیره  ۱۵ نمره هم امتحان پایان ترم
3664,4.166666666666667, تا حد امکان با ایشون  درس برندارید، همین.
3665,8.666666666666666, ایشون به جز فایل کتاب هالیدی هم معرفی میکنن؛ بسیار سخت گیر هستن و کوچک ترین اشتباه در حل سوالات نمره ایی بهتون تعلق نمیگیرد
3666,9.666666666666666, میانترم 7 نمره داره
3667,6.5, توی تلگرام گروه تشکیل میدن
3668,9.833333333333334, باهاشون بردارین خیلی خوبن و اصلا اذیت نمیکنن فقط یه تحقیق پاور میخوان و کلی وقت میدن تا ایمیل کنیم براشون نمره همه ۱۹ و ۲۰ شد
3669,9.333333333333334, حتما با ایشون درس وردارید پشیمون نمیشید
3670,10.0, عالین کار کلاسی هیچی نمیخوان واقعا استاد به این خوبی اصلا ندیدم امتحان عالی  و تایمش زیاد از دستش ندین واقعا
3671,6.5, استاد خوبین اذیت نمیکنن و واسه کسی که زیاد توجهی به یادگیری ندارن خیلی مناسبن نمره ۱۸ و ۱۹ دادن .
3672,3.5, به شدت بداخلاق و بی منطق هستن و اصلا خوب درس نمیدن . اصلا با ایشون کلاس برندارین که پوستتون کنده میشه
3673,10.0, استاد فوق العاده عالی هستن خیلی خیلی با دانشجو کنار میاد و امتحانش هم راحت بود
3674,10.0, امتحانشون خیلی سخت بود اصلا مثل مثال هایی که حل میکرد نبود ولی ارفاق زیاد کرد
3675,4.0, اصلا منصفانه نمره نمیدن و سر کلاساشون میخوابید.
3676,7.5, 🤷‍♀
3677,9.833333333333334, خیلی استاد مهربان و با حوصله ای هستند و علم زیادی دارن و به همه نمره عالی میده
3678,6.666666666666667, سر کلاس صدای ضبط شده میذارن و برای نمره دهی انگار تفکیک جنسیتی دارن!
3679,9.166666666666666, حافظه خیلی خوبی دارن
3680,1.8333333333333333, الان داره ترم جدید شروع میشه ایشون هنوز نمره هارو وارد نکردن که نتونیم اعتراض بزنیم، تدریسشونم افتضاح
3681,10.0, استاد یاسینی عالی‌ان هم از نظر تدریس هم اخلاق و نحوه رفتار با دانشجو و پاسخگویی
3682,10.0, از همه نظر عالی ان حتما باهاشون واحد بردارید
3683,7.166666666666667, طول ترم از روی هلن گاردنر انگار که دارن روخوانی میکنن،برای امتحان بخش هایی از همونو مشخص کردن و ارائه هم داشتیم باهمه اینا نمره خوبی ندادن
3684,10.0, یه تحقیق ۱۰ صفحه ای داشتیم و امتحانم تستی بود جزوه دادن از روی همون بخونیم، در کل خیلی استاد خوبی ان اصلا دانشجو رو اذیت نمیکنن
3685,10.0, ایشون خیلی استاد خوب و دلسوزی ان کاملا با دانشجو راه میان و در طول ترم اصلا اذیت نکردن
3686,1.0, بر ندارید نمره هم نمیدع اصلا. بچهای کلاس ما که از اخلاق و رفتارش اصلا راضی نبودن
3687,1.5, کلاسش همش ارائع است امتحان هم از کل کتاب میگیره نمونه امتحانشو بپرسید از بچها همتون سکته میکنید
3688,10.0, بسیار باسواد و شریف
3689,10.0, سر کلاس نمیان. و آخر ترم نمونه سوال می‌دهند و امتحان هم تستی بود. بسیار استاد خوبی هستند. و نمره هم دست باز
3690,9.666666666666666, هر جلسه حضور غیاب میکنن، ۱۲ نمره قرائت به صورت شفاهیه که برای هر غلط یک نمره کم میکنن، ۸ نمره امتحان کتبی، ولی در آخر هرچی بگیریو میدن بهت
3691,9.333333333333334, کلاسشون خشکه و حوصلت سر میره، ۱۰ جلسه کار نهاد میخوان با نمره ی بالای ۱۶، هم میان ترم و هم پایان ترم میگیرن و چند نمونه سوال طراحی میکنن
3692,9.166666666666666, استاد خوبی هستن اما توی نمره دادن واقعا غافلگیر میشید و چیزی که انتظار ندارید و بهتون میدن
3693,9.0, سر کلاس فعال باشیدو امتحانم نسبتا خوب بنویسید  نمره خوبی میگیرید امتحانشونم اسون بود
3694,7.666666666666667, اخلاقی اوکیه، حضور و فعالیت مهمه، یکسری تمرین باید انجام بدیم که راحته و تو نمره ترم تاثیر داره ، اخر ترم جزوه و نمونه سوال میده ،
3695,10.0, خیلی خیلی استاد خوبی هستن در همه موارد
3696,9.333333333333334, کلاسشون یکم خسته کننده‌ست ولی خوب درس میدن و باید سر کلاس فعال باشید
3697,9.833333333333334, از تمرین هایی که هرکدوم یک هفته وقت داشت تازه با همگروهی و همفکری، امتحان گرفتن، که منصفانه نبود!
3698,2.3333333333333335, شده فیزیک برندارین با ایشون برندارین
3699,7.5, هرجور دلش بخواد نمره میده تمام جلسات و رفتم با کلی فعالیت با نمره پایین پاس شدم 
3700,2.1666666666666665, یا میفتید یا ۱۰ الی ۱۳ میشید بنظرم به هیچ وجه با این استاد برندارید
3701,1.0, اصلا باهاش کلاس برندارید کلا دیر نمره میده و اگر ۲۰ بنویسید بهتون ۱۰ میده
3702,6.166666666666667, .
3703,4.833333333333333, اصلا با این استاد برنداریدزیاد خوب تدریس نمیکنند و میگن برید کتابو خودتون بخونید بیاید سوال داشتید بپرسید نمره ی خوبی هم نمیدن
3704,2.3333333333333335, برای ما که مجازی بود معمولا هر جلسه پرسش اجباری داشت نمره خوبی هم نمیشد گرفت ازشون 
3705,8.333333333333334, اهل فعالیت کلاسی هستید پاس میشید ، ولی در طول ترم فعالیت کلاسی و پروژه ارائه ندن ، مطمعنا پاس نمیشن
3706,8.666666666666666, خوب نمره میده ، حضور مهمه براشون
3707,9.666666666666666, استاد بسیار خوب ، به همه نمره عالی میدن ، حتما با ایشون درس بردارید ، حضور غیاب ندارن
3708,7.0, خوب نمره نمیدن ، وصایا ۱۴ شدم ، حضور غیاب نمیکنن ، زمان امتحان کم بود
3709,1.8333333333333333, اصلا نمره نمیده ، ۹۰ ٪ کلاس میوفتن ، به هیچ عنوان باهاش درس برندارید ، از کلاس ۳۶ نفره ۳۳ نفر افتادن
3710,9.333333333333334, استاد خوبین زیاد سختگیر نیستن و هر چندبار که بگین سوالات توضیح میدن واز نظر نمره هم نمره برگتون میدن ارفاق نمیکنن
3711,10.0, استادی عالی هستن حتما باهاشون بردارید
3712,5.0, خیلی پایین تر چیزی که نوشتم نمره دادن اصلا منصفانه نمره نمیدن و اینکه استاد خشکی هستن
3713,8.166666666666666, زمان ازمون رو کم میدن سوالات رو عمقی میدن سر کلاس درس خاصی نمیدن ولی نهاد رو حتنا میخوان از دانشجوها و درکل نمره ی خوبی نمیشه ازشون گرفت
3714,9.666666666666666, درکل استاد خوبیه، سرکلاسش باید فعال باشی و بشناستت، که به نفع خودتون هم هست اینجوری درس رو خیلی راحت یاد میگیرید، امتحانش هم سخت نیست
3715,4.5, برندارید ، چون هیچی یاد نمیگیرید 😐
3716,9.666666666666666, امتحانشون خیلی اسون و خوبه خیلی خوب هم نمره میدن درکل همه چی عالیه تکلیف هم نداریم
3717,3.0, امتحانی که میگیرند در حد تدریسی که میکنند نیست و توجهی به اعتراضات نیز ندارند
3718,10.0, استاد خوبیه👌
3719,2.6666666666666665, اصلا،خوب درس نمیدن،نمره هم افتضاح،من درحد ۲۰ نوشتم و مطمئن بودم،بهم داد ۸،سرکلاسشم باید فعال باشی و گرنه بهت منفی میده،کلا برندارید
3720,1.1666666666666667, اگه استادی میخوایین که ریاضی رو باهاش نفهمین پیشنهاد میکنم با ایشون بردارین
3721,8.666666666666666, دست باز و با ارفاق
3722,4.666666666666667, به هیچ عنوان برندارید چون این ترم به همه از ۱۰ تا ۱۲/۵ دادن صرف نظر از اینکه چقدر برگه رو پر کرده بودین و امتحان خیلی سخت و بالاتر از جزوه
3723,10.0, استادی با سواد وعالی هستن اصلا دانشجو رو اذیت نمیکنن
3724,10.0, هر درسی ک ارائه داشتند رو باهاشون بردارید چون بنظرم جزو بهترین اساتید دانشگاه هستن و کلاسشون جزو دوست داشتنی کلاسا هست و پشیمون نمیشید
3725,10.0, استاد خوبی هستن _ برای ورزش یه موضوع باید انتخاب کنی و ارائه بدی که میشه نمره پایان ترم _ نمره هم خوب میدن _در کل عالی بود
3726,8.833333333333334, کلاس مجازی داشتم باهاشون صدای ضبط شده میزاشتن برامون من که چیزی نفهمیدم
3727,7.666666666666667, استاد خوبین اما تو انتقال مطلب چندان واضح نیستند
3728,2.5, توی دان درس نمیدن٬ محتوای درسی رو به صورت یه سری ویس توی کانال تلگرامشون میذارن نمره خوب میشه ازشون گرفت اما یادگیری اتفاق نمیوفته سرکلاس.
3729,2.6666666666666665, سه تا کوییز گرفتن تو طول ترم،تکلیف هم میدن اونم تو حجم زیاد و اکثرا سخت، امتحان پایان ترمم خیلی سخته و سوالات بر اساس رقم دانشجویی متفاوته
3730,9.833333333333334, استاد مهربون و خوش برخوردی بودن.کلاساشون مجازی بود اما واقعا جذاب بود خیلیم خوب نمره میدن با دانشجو تا جایی که بتونن کنار میان
3731,5.666666666666667, برخوردشون خیلی با دانشجوها بد بود واقعا با لحن درستی صحبت نمیکردن کار کلاسی زیادی هم میخواستن ولی نسبتا خوب نمره میدادن
3732,9.5, استاد مهربونی بودن و خیلی با علاقه درس میدادن
3733,8.333333333333334, استاد خوبی بودن خوش اخلاق و خوش برخورد تا جایی که میتونستن درسو جذاب میکردن
3734,6.166666666666667, اصلا با این استاد برندارین. امتحان شفاهی با صدا و تصویر میگیرن و تقریبا ۶۰ درصد کلاس رو میندازن
3735,3.5, سواد نداره و خودشم نمیدونه داره چی درس میده ، خلاصه اگه میخواین چیزی یاد بگیرین سمتش نرید
3736,9.666666666666666, بی نظیره
3737,5.166666666666667, بدک نیست ، نمره خوب میده ولی چیزی یاد نمی گیرید و اینکه خیلی خسته اس ، اولویت دوستون باشه
3738,9.333333333333334, نهاد و سرکلاس حاضر بودن مهم، امتحان سخت بود.در کل اگه دانشجو منظم و حرفشنو هستین باهاش بردارین
3739,9.666666666666666, استاد خیلی خوش اخلاقیه و بنظرم اگر که فارسی خوب بلدید باهاش بردارین
3740,4.666666666666667, تدریسش ضعیفه صرفا فیلم میزاره 
3741,3.1666666666666665, نمره دهی افتضاح حتی اگه بی غیبت باشی و تکالیفو انجام بدی
3742,9.666666666666666, استاد معمولی بودن برای امتحان نکات مهم نمیگن و برای امتحان منبع کتاب هست و حجمش زیاده واقعا.
3743,1.0, تو این کلاس فقط وقتتون تلف میشه و هر 2 دقیقه استاد میگه یه مثبت بفرستید تو چت و چیزی هم یاد نمیگیرید
3744,1.8333333333333333, واقعا بکی از مزخرف ترین استادای تهران مرکز
3745,10.0, استاد خیلی خوبی هستند
3746,2.0, اگه میتونین با ایشون کلاس بر ندارین
3747,4.833333333333333, استادی است که خیلی کار میده ولی توضیحات کافی درباره کارهایی که از دانشجو می خواهد نمیدهد
3748,3.3333333333333335, هیچ ارتباطی نمیشه داشت نمره رو دیر میدن وقت انتخاب واحد میشه
3749,2.1666666666666665, راه ارتباطی کلا نیست
3750,9.0, استاد خوبيه خوب درس ميده مطلب رو قشنگ ازشون ياد ميگيري ولي متاسفانه هرطور دلشون بخاد نمره ميدن
3751,7.166666666666667, اگر میخوایید اعصابتون خورد شه باهاش بردارید
3752,4.166666666666667, کلاس برندارید اصلا استاد خوبی نیستن فقط می‌خوان بندازن شمارو
3753,9.333333333333334, سر نمره نامردی میکنه و با پسرا زیاد اوکی نیست،سر ۲ جلسه غیبت از من ۳ نمره کم کرد(با تعداد غیبت بیشتر به خانوما نمره کامل داده بود)
3754,10.0, استاد خوبی بودند اخر ترم پی دی اف تمرین ارسال کردند که اگر دانشجویی کسری نمره از تمرین داشت ،جبران می کرد . خیلی استاد با حوصله ای بودند.
3755,1.6666666666666667, کلاس استاد ضبط شده است .پراکنده درس میدن.امتحان  تقریبا سخت بود و اصلا نیازی به خرید کتاب نبود چون  فقط بعضی کلمات معنی می کردند
3756,4.333333333333333, در پایان ترم به همه نمره به شدت پایینی میده، اگر معدلتون اهمیت داره با ایشون بر ندارید
3757,9.166666666666666, در طول ترم باید دو تا ارائه داشته باشی واسه ما فوتوشاپ بود ک از مراحل عکس گرفتیم و سر کلاس ارائه دادیم
3758,9.5, در طول ترم باید دو تا ارائه داشته باشی واسه ما فوتوشاپ بود ک از مراحل عکس گرفتیم و سر کلاس ارائه دادیم
3759,6.166666666666667, ایشون بار علمی بسیار پایینی دارن و خیلی از کلمات ساده رو اشتباه تلفظ میکنند  که خندت میگیره. نمرتم پایین تر از چیز واقعی میده
3760,10.0, استاد فوق العاده محترم و مهربونی هستن.در طول ترم حتما فعالیت داشته باشید 3 نمره فعالیت کلاسیه.
3761,10.0, این استاد بیشتر کلاساش واتس آپ برگزار میشه.
3762,9.666666666666666, این استاد قرار بود امتحان پایان ترم حضوری بگیره ولی امتحان از ما نگرفت نمره ها براساس حضور درکلاس وارد کرد. استاد خوبیه.
3763,10.0, این ترم از ما۴تا کوئیز و۱ میان ترم از ۴فصل آخر گرفت. برای امتحان پایان ترم حذف کردو فقط از ۴تا فصل اول امتحان پایان ترم گرفت.
3764,9.5, در طول ترم باید دو تا ارائه داشته باشی واسه ما فوتوشاپ بود ک از مراحل عکس گرفتیم و سر کلاس ارائه دادیم
3765,7.833333333333333, استاد خوب و محترمی هستن فقط و فقط حجم جزوه ایشون وحشتناک تا پایان ترم و هر جلسه یک نفر باید از توضیحات ایشون پی دی اف و ویس جمع آوری کنه
3766,7.666666666666667, استاد خوب و باسوادیه
3767,9.166666666666666, استاد  خوشرو  و  با  اخلاق
3768,3.6666666666666665, اصلا استاد خوبی نیست و برای نمره همه چی رو دقیق بررسی میکنه به نظرم با این استاد برندارین
3769,10.0, استاد خوبی هستن اما برای امتحان کل کتاب باید بخونید و حجم مطالب زیاده.
3770,1.0, پارتی ایشون کلفته در حدی که ما اکثرا مترجم بودیم و امتحان در حد ۲۰ بودیم ولی به همه ۱۰ و ۸ داد رندوم به یک نفر هم شانسی ۱۳
3771,8.0, استاد بسیار عالی هستن فقط نمره خوبی نمیدن حتی امتحانشونم اسون و درحد جزوشونه ولی نمره نمیدن
3772,10.0," به بیشتر دانشجوها در حد 14 ,15 نمره دادن ، ولی حتما حتما باید سرکلاس فعال باشید یادش میمونه و تو نمره پایانی تاثیر میده. من 19 شدم."
3773,2.6666666666666665, اصلا و ابدا کلاس براش اهمیتی نداره و مدام برای نیومدن هاش بهونه داشت که این ساعت سرم شلوغه اما هنوز که هنوزه نمره هارو هم حتی وارد نکرده
3774,8.0, استاد بدی نیستن سواد بالایی دارن در کل ترم مفیدی داشتیم چیزهای زیادی یاد گرفتیم اما نمره ای که حقمون بود رو ندادن
3775,5.333333333333333, تقریبا هر جلسه نیم ساعت میان متوجه نمیشید چی میگن نصف کتابو امتحان میگیرن و برگه رو صحیح هم نمیکنن در اخر به همه از ۱۴ تا ۱۶ یه نمره ای میدن
3776,10.0, استاد عالی هستن و با دانشجوهاش دوسته کلاس شاد و خوبی دارن حوصله تون سر نمیره پرانرژی هستن
3777,2.8333333333333335, استاد سخت گیری هستن، نمرات را دیر وارد میکنند و پاسخ گو نیستن و اگر میخواید  اعصاب  درست  براتون  بمونه سعی کنید با ایشون برندارید.
3778,9.666666666666666, استاد ماهیه بهترین استادی که داشتم ارسال تمرین ها براشون خیلی مهمه و باید فعال باشین من به شخصه با رعایت اینها۲۰ازشون گرفتم
3779,10.0, استاد عالیه هر درسی ارائه داد بردارین تدریس عالی خیلی تو نمره دادن ارفاق میکنه یکی از بهترین استادا
3780,4.0, فقط از کتاب رو خونی میکنه و نمره دادنشم منصفانه هستش
3781,5.0, درس نمیده فقط از روی کتاب میخونه هر جلسه هم چیزی ک از روی کتاب اون جلسه خونده رو میپرسه و اگه بلد نباشی منفی میزاره
3782,9.833333333333334, استاد خیلی خوبی هستن بسیار با شخصیت و برای دانشجو احترام قائل هستن  نمره دادنشونم یه جورایی منصفانه هستش و هر چی خودت بگیری
3783,4.5, اصلا برندارید هیچی از توضیحاتش نمیشه فهمید اونقدر تند حرف میزنه آخر سرم همه رو یا میندازه یا نمره پایین میده
3784,1.0, افتضاح همرو میندازه  سر کلاس نمیاد آخر ترم یهو میاد یه چیز سخت میگه  میره فرقی نداره عالی باشید باز میندازه
3785,5.666666666666667, هر جلسه یک ساعت حرف میزنن .این درس مطالب سختی داره و نوشتن این همه جزوه سخته انگار که دارید کتاب تالیف میکنید
3786,6.166666666666667, کلی بخونید و کار انجام بدین بین ۱۷ تا ۱۸ میشید 
