,score,comment
0,9.5, استاد خیلی محترم و خوبیه و به دنبال اینه که با نمره بالا پاس کنه دانشجورو
1,1.0, اصلا استاد خوبی نیست
2,10.0, واقعا استاد نازنینیه باهاشون بردارید حتماااااااا
3,8.166666666666666, حتما باهاشون بردارید پشیمون نمیشید
4,9.5, به حضور وغیاب به شدت حساس  غیبت  با دلیل موجه هم باشه باز قبول نمیکنه سر کلاس 
5,7.333333333333333, با برنامه کامپیتوتر خود تدریس میکنه چون بدون برنامه  امتحان میدیم و باید روی کاغذ شکل هارو رسم کنیم یادگیری خیلی دشوار میشه
6,2.5, به مطالب درسی تاریخ نمایش نمیپردازن و به مطالب غیر عنوان درسی میپردازن ، نمرده دهی دلخواه
7,9.666666666666666, استاد خوبی هستند ، تحقیق زیاد میدن به بچه ها برای اینکه به نمره پایان; ترم کمک بشه بهشون .
8,6.666666666666667, کلا سعی کنید اگه کلاس مجازی بود ، باهاشون بر ندارید و امتحانشون مو به موی کتاب رو باید باد باشی
9,10.0, یکی از بهترین اساتید هستند بی شک ، حتما باهاشون بردارید از هر لحاظ عالین
10,9.333333333333334, سوال دادنشون عینا مثال جزوس ، تایم کلاساشون کوتاهه و خیالتون هم از بابت نمره راحته
11,4.333333333333333,  اکثریتو به بهونه های الکی میندازه امتحانشم شدیدا سخت و خارج از جزوس
12,2.8333333333333335, اصلا باهاش برندارید یا ۸ میده یا ۱۰ خیلی بد نمرس اخره ترم میفهمید چی میگم
13,5.5, برندارید باهاش امتنانش خیلی سخته
14,10.0, عالی بهترین استاد
15,10.0, باهاش بردارید خیلی استاده گلیه
16,10.0, خیلی خوبه حتما بردارید باهاش
17,5.666666666666667, بدک نیست
18,10.0, عالی
19,9.333333333333334, استاد بسیار خوبی هستن. هر هفته تمرین میدن که باید ایمیل کنیم و پروژه تعریف میکنن که باید انجام بدیم و سر کلاس ارائه بدیم.
20,3.1666666666666665, پیشنهادم اینه که تا میتونید با این استاد برندارین وگرنه مثل من پشیمون میشید
21,4.833333333333333, در کلاس هم فایل صوتی که قبلا ضبط کردن رو پلی میکنن و خودشون چندان صحبتی نمیکنن
22,8.833333333333334, در کل استاد خوبین. و اینکه چون فاصله سنی کمی با دانشجویان دارند دانشجو را درک میکنند.
23,1.6666666666666667, کلا سخت گیره و تکلیف خیلی میده مثل ابتدایی باید از روی کتاب بنویسی 
24,10.0, عالین
25,9.333333333333334, در کل استاد عالی هستن
26,1.0, تدریس ندارند، کارکلاسی و منبع امتحان ارائه کلاسی است که اجباریست و اصلا به موضوع درسی ربطی ندارد.گاهی با لحن تندی صحبت میکنند.
27,6.166666666666667, دانشجویان ارائه کلاسی میدهند و ایشان گاهی تدریس مختصری ;کنند منبع امتحان همین ارائه هاست. برای پاس کردن خوبه ولی برای یادگیری درس نه.
28,9.666666666666666, رشته علوم و صنایع غذایی 
29,8.833333333333334, ۳،۴ نمره پایین تر از چیزی که فکر میکنی نمره میده اخر ترم 
30,9.833333333333334, عالی ترین هستن ایشون
31,10.0, استاد خیلی خیلی خوبی هستن و تسلط کافی رو درس دارن پیشنهاد میشه حتما هر درسی ارائه دادن بردارید .
32,9.0, استاد خوبیه ولی رو تجارت ۲ یکم سخت گیره
33,1.0, خیلی ***
34,1.0, باهاشون اصلا بحث نکنین چون حذفتون میکنه
35,5.666666666666667, برندارید که افتادید با نمره بد
36,1.0,  بد
37,3.6666666666666665, نمره دهی به صورت کاملا رندوم
38,9.666666666666666, استاد بسيار دانايي هستند ولي متاسفانه وضعيت نمره دادن در اين ترم بسيار شانسي بود و حتي شايد برگه اي هم صحيح نشد و نمره وارد شد
39,10.0, باسوادوفن بیان عالی
40,2.6666666666666665, توصیه میکنم اصلا با ایشون برندارید از نمره‌ی واقعیتون حداقل سه نمره کم میکنن. من ۲۰ میشدم ولی ۱۷دادن
41,3.6666666666666665, ايشون کرامت انسانی و شان دانشگاهي رو رعايت نمي كنند...
42,10.0, حتماً با ايشون كلاس برداريد.
43,10.0, کلاساشون پر انرژیه. در طول ترم سوالات اضافه می‌پرسند و + نیم نمره ای میدن، امتحان رو هم خیلی راحت میگیرن.
44,9.833333333333334, علم استاد خیلی بالاست. از اون استاد هایی هستند که واقعا ازشون میشه چیز های زیادی یاد گرفت.
45,9.5, برای امتحان نمونه سوال میدن که کافیه. حضور اجباریه ولی اگر غیبت داشتید میتونید در سایت نهاد یک جلسه بگذرونید تا غیبت جبران شه
46,9.166666666666666, استاد کیا، استاد بسیار خوبی هستند پیشنهاد میکنم هر درسی که ارائه دادند با ایشون بردارید.
47,10.0, استاد عالی هستن و خیلی با سواد و منطقی و مهربان
48,10.0, استاد خیلی باسواد و عالم و خوش برخورد و مهربان ، از نظر علمی بالاتر از ایشون هیچکس نیست ، از نظر ادب و اخلاق بهترین هستن
49,10.0, از نظر علمی خیلی باسواد و از نظر اخلاق یه ذره تند و خشن 
50,10.0, استاد بسیار با سواد و خوش اخلاق و رفتار 
51,10.0, استاد خیلی مهربان و با صفا 
52,8.166666666666666, تکالیف و پرسش هایی که می پرسن اگه خوب جواب بدی و منظم سرکلاس حضور داشته باشی و فعالیت خوبی داشته باشی می تونی نمره خوبی بگیری
53,10.0, یکی از بهترین و محترم ترین اساتید این دانشگاه هستن ایشون و از کلاس برداشتن باهاشون پشیمون نمیشید
54,8.333333333333334, استاد خوبیهستن فقط اذیتشون نکنید سرکلاس چون لج کنن باهات حافظه خوبی دارن و در طول ترم حسابی اذیت میکنن😂
55,1.0, توصیه میکنم هیچ وقت باهاش برندارید
56,6.333333333333333, در کل استادیه که با کارای خودت کلاس میره جلو.سوالیم بیرون کلاس ازش نمیتونی بپرسی چون هیچ شماره ای نمیده بهت.در کل زیاد توصیه نمیکنمش.
57,2.1666666666666665, بین بچه ها به شدت فرق میزارن 
58,7.333333333333333, سخت گیرن تقریبا
59,2.8333333333333335, ایشون متاسفانه چندین جلسه به کلاس نیومدن و سوالات امتحانی که دادن سخت بود.
60,10.0, عالی و درجه یک 👏🏻 با اخلاق ، پاسخگو ، مسلط به مبحث و ...
61,10.0, استاد ملک نجاد فوق العاده استاد دلسوزی هستن تو این شرایط ک کلاسا مجازی هست زیاد دانشجورو اذیت نمیکنن صد درصد توصیه میکنم باهاشون بردارید
62,8.666666666666666, خیلی استاد سختگیریه ترجیحا با ی استاد دیگه کلاس بردارید
63,9.5, امتحانش از ۲۰ نمره هستش و هیچ ارفاقی نداره حتی ۲۵ صدم
64,10.0, عالیه بردارید باهاش .
65,10.0, عالیه
66,10.0, پرسش کلاسی داره هر جلسه ولی کلا سخت گیر نیس جهت کمک به دانشجو هستش .بردارید حتما باهاش
67,10.0, استاد خیلی خوبیه بردارید
68,5.5, ایشون اصلا به کلاس اهمیت نمیدن. بچه ها به نوبت باید ارائه بدن. ایشون نه نکته ای میگن نه درسی میدن. انگار نیستن اصن تو کلاس.
69,2.5, بر ندارین 
70,4.666666666666667, یکی درمیون ۸ و ۱۰ میدن
71,10.0, بسیار استاد خوب و مهربونی هستن
72,10.0, بسیار استاد خوبی هستن حتما باهاشون بردارین
73,10.0, هر چی از خوبیای این استاد بگم کم گفتم 
74,9.333333333333334, خیلی استاد خوب و باسوادی هستن
75,6.666666666666667, شاید کلاسای حضوریشون بهتر باشه ولی من از کلاس مجازیشون اصلا راضی نبودم.
76,10.0, در کل استاد خوبی هستند و خوش برخورد و محترم اما به حضور غیاب مقداری حساس اما با دانشجو راه میان تا جایی که امکان داشته باشه
77,10.0, استاد خیلی خوبی هستن،اگر سطح زبانتون خوبه و فعالیتتون سر کلاس زیاده بردارین باهاشون،در غیر این صورت برندارین
78,9.166666666666666, استاد سخت گیری هستن،و فعالیت زیاد ازتون میخوان،نمره هم خیلی سخت میدن،اگر حوصله درس خوندن ندارید، برندارید
79,8.333333333333334, اول فکر میکنید خیلی سخت گیر هستن،اما دست و دل باز نمره میدن، امتحانشون هم از کتابه و سخت نیست
80,10.0, به شدت استاد باشخصیتی هستن به نظرم اگه میخواین نمره خوبی بگیرم حتمااااا با ایشون بردارین خیلی ماهن🥰🌹
81,9.666666666666666, متعهد، با مسئولیت، دلسوز و خوش برخورد بودن. هر مطلب رو چند بار تکرار میکردن. فقط باید فعالیت داشته باشید چون مهمه براشون
82,4.833333333333333, اگر باهاش کلاس برمیدارین باید سر کلاس کاملاااا حواس جمع باشین وگرنه میفتین
83,3.3333333333333335, به شدت امتحانشون رو سخت میگیرن و خیلی شلخته کلاس هاشون رو برگزار میکنن جواب پیام های دانشجو رو هم نمیدن ترجیحا باهاشون برندارین .
84,1.0, ***بر ندارید آقا بر ندارید
85,6.666666666666667, استاد خیلی مهربونی هستند و بسیار راحت نمره میدن و با بچه ها راه میان اما اگه کسی میخواد زبانش پیشرفت کنه برنداره چون لهجشون اصلا خوب نیست.
86,1.0, کتابی معرفی می کنه که دیگه چاپ نمیشه و حتی ازش pdf یا اسکن هم نمیده 
87,3.3333333333333335, تا میتوانید با ایشون درس برندارید چون حتی اگه دانشجوی خوبم باشین ایشون به شما نمره خیلی خیلی پایینی میدن و اصلا نمره الف به کسی نمیدن😔
88,9.166666666666666, استاد شهری  آنچنان سخت گیر نیستند
89,3.0, به هیچ وجه پیشنهاد نمیکنم با این استاد درسی رو بردارید
90,9.166666666666666, کار عملی داره 
91,9.833333333333334, نمره امتحان از ۱۰ نمره بود ۱۰ نمره بقیش حضور + فعالیت کلاسی 
92,10.0, جاهای مهم امتحان مشخص میکنن خیلی راه میان با دانشجو حتمااا بردارید
93,10.0, با این استاد دیدتون نسبت به اطرافتون کلی تغییر میکنه. عشق ترین استادی که داشتم
94,10.0, من باهاشون مجاری داشتم خیلی مهربون بودن. 10 الی 13 نمره کلاسی بود اگه کارایی که میگن بکنید نمره خودتون میگیرید
95,1.6666666666666667, *** فقط توصیه میکنم اصلاااا حتی اگر مجبور بودید انتخابشون نکنید
96,9.0, همونطور که گفتم حضور خیلی مهمه، البته برای ما که مجازی بود آخر ترم گفتن شنا بزنید فیلم بگیرید بفرستید😐 ولی خوب نمره دادن.
97,10.0, خیلی استاد خوب و مهربونی هستن و به دانشجو احترام میزارن
98,10.0, استاد بااخلاقی هستند و بسیار خوش برخورد
99,10.0, امتحان پایان ترم ایشون ندارن برای درس ورزش ۱ باید ارائه بدیم برای درس تربیت بدنی هم هرکی کلاس هارو کامل اومد ۲۰ دادن
100,4.5, تو این درسا گزینه های بهتری هم هست با یکی دیگه بردارین امتحانش واقعا سخته
101,7.166666666666667, نمره خوب میخواید به شدت باید فعال باشید درس بخونید و‌کارکلاسی انجام بدید و کارگروهی هم باید تحویل بدید که شامل ۱۰سوال هست که هر جلسه میدن
102,7.833333333333333, استاد خوبیه ، میتونه جز اولویت ها اولتون باشه روی قرائت خیلی مانور نمیده ، ولی امتحان کتبی ممکنه ۱ الی ۲ نمره کمتر از چیزی که گرفتی بده
103,9.666666666666666, واقعا استاد خوبی هستن هر درسی ارائه دادن حتما با ایشون بردارید 😍😍😍
104,1.1666666666666667, ** بد
105,4.833333333333333, بد
106,9.666666666666666, خیلی استاددلسوزیه و برای پایان ترم صفحات مهم رومشخص میکنه
107,9.166666666666666, بسیار استاد خوش اخلاق و عالی هستند.
108,10.0, ایشون بسیار با شخصیت و دلسوز و با درک هستن. خیلی دانشجو رو درک میکنن. با فعال بودن و فرستادن تکالیف به راحتی میشه ۲۰ گرفت ازشون
109,9.5, استاد خوبی هستن به نظرم. تمام سوالات امتحان رو بهمون دادن که بخونیم و سوالات امتحانشون هم منصفانه و از همون سوالای خودشون بود
110,5.666666666666667, با این کرونا شاید کسی نمیتونسته تمرینی بده ولی خونده برای امتحان چرا باید از ۸ نمره گرفته بشه با این همه سخت گیری؟! 
111,9.5, استاد خیلی شوخی هستند و البته دلسوز حتما باهاشون بردارید تایمی که دارید اصلا ازش خسته نمیشید خیلی خوبه در کل
112,8.833333333333334, استاد خیلی خوبی هستن ، حتما سعی کنید باهاشون بردارید چون بسیار دقیق و منظم هستن
113,9.333333333333334, عالیههه عالییی. خیلیی استاد مهربونیه نمره دادنشم عالیه یه عالمه ارفاق میکنه حتماا بردارین باهاش
114,7.0, حضور اصلا براش مهم نیست و کلاس رو با یک نفر هم تشکیل میده و اگه فقط یک نفر هم کلاساشو بره ولی امتحانو خراب کنه باز میندازتش
115,3.5, اصلا براش مهم نیست که یاد گرفتی یانه .همه چیو پخش و پلا و نصفه درس میده یه سری مباحث رو هم اضافه درس میده و تو امتحانش میاد
116,5.666666666666667, نمره خوبی نمیشه گرفت ، خیلی تمرین و مسئله برای حل میدن و نمره فعالیت ها کم است .  و بسیار سختگیر هستن
117,6.0, استاد خوبیه ولی بخاطر مجازی بودن نهاد و کنفرانس داشتیم و سخت بود . البته ۱۰ نمره کلاس رو این کارا داشت . در کل بخوام بگم اوکیه.
118,2.6666666666666665, اگه اعصابتون براتون مهمه و میخواید که توی درستوت پیشرفت کنید به هیچ عنوان این استاد رو انتخاب نکنید
119,1.0, تورو خدا با این استاد درس بر ندارید میندازتتون یا نهایت با ۱۰ پاس میشین 
120,10.0, عالییی هستن
121,5.666666666666667, اخر ترم صدوچهل تا سوال دادن که بخونیم برای امتحان و اصلا امتحانو صحیح نمیکنن فردای امتحان به کل کلاس از دم پونزده داد
122,7.0, *** تقریبا  هرچی خودت بگیریه ولی بد نمره میده. امتحانش تستی بود و ارائه خواست کلاسش خسته کننده است خوب درس نمیده
123,4.333333333333333, پروژه ۵ نمره ای بهمون دادن و هیچ کمکی در این پروژه به ما نکردن. حضور غیاب و حل تمرین هم ۵ نمره داشت.
124,10.0, یکی از باشخصیت ترین اساتید تهران مرکز هستن ایشون واقعا در انتخابشون شک نکنید👌
125,9.666666666666666, پیشنهاد میکنم حتما با ایشان کلاس بردارید
126,10.0, بسیار عالی
127,1.3333333333333333, بین دانشجوها زیاد فرق میزارن و لهجه ی خوبی هم ندارند
128,1.0, آدم منطقی نیستند و هیچ جوره نمیشه باهاشون کنار اومد اصلا با ایشون برندارید
129,8.5, شاید خیلیا ازش بد بگن ولی واقعا تا جایی ک بتونه کسیو نمیندازه و راه میاد.و اگه جزوه و نکاتی ک سرکلاس میگه خونده شه راحت میشه امتحانشو داد
130,9.0, خیلی استاد خوبی هستن و واقعا به پیشنهادات بچه ها احترام میزارن و اگه هم اشتباهی بکنن خودشون مستقیما عذرخواهی میکنن
131,9.166666666666666, نزدیک به امتحان که میشه اصلا پاسخگو نیستن به دانشجوهااا
132,9.833333333333334, اصلا کلاسشون خشک نیس فقط تدریس نمیکنن درس اخلاق هم میدن وکلاس خیلی جنبه خوبی داره
133,6.666666666666667, اصلا به دانشجو ها جزوه ایی ندادن و میگفتن که باید خودمون بنویسیم سر امتحان خیلی اذیت شدیم واقعا چون حوزه همه ناقص بود
134,1.6666666666666667, اصلا درس رو نفهمیدیم یهو میدیدیم وسط کلاس گوشیشون زنگ میخورد میرفت ۱ ساعت باتلفن حرف میزد و میکروفون رو قطع نمیکرد
135,9.166666666666666, اول هر کلاس کوییز میگیرن و اینا ۱۰ نمره ترم هست ولی خیلی پیگیر دانشجو هستن و پاس میکنن اگه بتونن
136,10.0, خیلی استاد باحالی هستن اگه میتونین بردارین باهاشون
137,5.666666666666667, سختگیر و ***
138,9.5, خیلی استاد خوبی هستن و اصلا دانشجو رو اذیت نمیکنن اگه درس جواب بدی اخر ترم نمره اضافه میکنن
139,9.0, استاد خوبی هست و با ارفاق صحیح میکنه من ۱۹ گرفتم
140,1.6666666666666667, یکی از بدترین کلاسایی بود که داشتم کلا یک کتاب مرجع رو باز میکردن و فقط از رو اون میگفتن و میرفتن جلو اصلا پیشنهاد نمیکنم
141,10.0, استاد خیلی‌خوب و محترمی هستن و جزوه هاشون هم کامل هست و به راحتی میتونید پاس شید
142,8.666666666666666, استاد خوبی هست و بسیار تسلط داره و اگر نفعمید درس رو تا ۱۰ بارم براتون توضیح میده ولی نمیرسه به اتمام جزوه
143,9.833333333333334, استاد خوبی هستن ولی بسیااار تمرین میدن و کل زنان کلاس رو باید باشید حدود ۲ ساعت 
144,9.833333333333334, استاد خوبی هستن ولی حتما باید بخونید جزوشون رو چون فیلم های آموزشی یا کتاب خیلی فرق میکنه
145,10.0, استاد خوبی هستن و کلاس هاشون بسیار مفرح هست و حتما توصیه میکنم با ایشون بر دارید
146,3.8333333333333335, اگه میخواید این درس رو بیوفتید با این استاد بردارید به شدت به دانشجو توهین میکنن و سخت گیر هستند و تقریبا همرو میندازن.
147,8.166666666666666, استاد خیلی خوبی هستن ولی باید خوده دانشجو تلاش کنه و سوالایه امتحانشون رو مثل جزوه میدن و اگه یکم تلاش کنید میتونید راحت پاس شید😁
148,4.0, ایشون هفته ای ۲تا گزارشکار میخواستن 
149,4.5, ایشون کلا نمره دادنش دل بخواهیه( نمره پایینی میدن)بنظر من برگه صحیح نمیکنن کسانی که معدل و نمره براشون مهمه برندارن
150,8.166666666666666, اصلا درس نمیده ،ازهفته قبل خودش مشخص میکنه باید بیای درس بدی خودت
151,4.166666666666667, شانسی نمره میدن و تدریسشون غیر قابل فهمه سعی کنین برندارین با ایشون
152,9.833333333333334, سوالاتشون خیلی خیلی راحته
153,9.666666666666666, استاد مودب و خوبیه . هر وقت سوال داشته باشی خیلی خوب جواب میده خیلی هم در تدریس مسلط و نرم
154,9.333333333333334, درکل استاد خوبی هستن و خیلی به دانشجو ها کمک کردن که نمره خوب بگیرن زمان امتحانو کم کردن که کسی تقلب نکنه ولی به همه بیشتر از حقشون نمره داد
155,9.0, بسیار خوب تدریس میکنن.
156,5.833333333333333, در کل استاد باسوادی هستند ولی نحوه برخورد استاد با دانشجو خیلی مناسب نیست
157,10.0, استاد بامعلوماتی هستن در طول ترم فعالیت نهاد جز ۵ نمره کلاسی هستش
158,8.5, سرکلاس خیلی جدی هستن
159,10.0, اگر تمام جلسات رو باشید و فعالیت در کلاس داشته باشید و مسائلی که
160,8.666666666666666, استاد خوبی هستن و با دانش . پیشنهاد میدم باهاشون بردارید
161,4.666666666666667, تا میتونید باهاشون درس برندارید
162,10.0, مطالب تدریس شده حجمش خیلی خیلی زیاده و نمره ای که گرفتم کمتر از حد انتظارم بود
163,1.8333333333333333, ***بد
164,10.0, استاد با ادب و مهربان و دلسوز
165,3.8333333333333335, استاد خوبی نیست، نمیشه نمره خوبی ازش بگیرید ، یه کتاب معرفی میکنه ۴۰۰ صفحه و یه پاورپوینت بدرد نخور باهاش برندارید که آخرسر پشیمون میشید
166,10.0, خیلی خوش برخورد و مهربان 
167,9.5, خیلی استاد خوبیه پیشنهاد میکنم بردارید
168,8.5, خیلی استاد با سوادی هستن و تبلیغاتی که بقیه دوستان کردند منصفانه نیست و نمره خوبی هم میدن اگه برا یادگیری سر کلاس میروید واقعا عالین
169,5.333333333333333, تنهاچیزی ک واسش مهمه اینه ک میکروفنتو وصل کنی صحبت کنی اگ نتونی میکروفن وصل کنی حرف بزنی نمره کم میکنه.۸۰٪ زمان کلاس ب بحثای حاشیه ای میره
170,9.0, فعالیت کلاسی خیلی براشون مهمه و نصف نمره پایانی رو از فعالیت کلاسی میدن
171,10.0, خیلی استاد با سواد و خوش برخوردی هستن‌ من که ازش بدی ندیدم واقعا
172,9.833333333333334, استاد خوبی هستن واسه درس مدار الکتریکی چون بقیه داغونن
173,8.166666666666666, سعی کنید زیاد حرف نزنید سر کلاس برای هر حرف اضافه ای منفی میگیرید. سوال هارو هم جواب نمیده
174,1.8333333333333333, به نظر من اگر میخواید اعصابتون در طول ترم بهم نریزه به هیچ عنوان با این استاد درسی رو ور ندارید واقعا با روح و روان آدم بازی میکنه
175,10.0, در همه ى ساعات پاسخگوى دانشجويان بوده كلاس خيلى گرم و صميمى
176,10.0, امتحان نداره فقط یه پروژه داره از درسایی که دادن و باید ارائه بدیم اگه داوطلبانه ارائه بدین ۲۰ میدن
