,score,comment
1287,7.666666666666667, در کل سختگیرن و هر درس یک مدلسازی و چهار مقاله میخواست که ریز بررسی میشه و در طول ترم هم مقداری از وقت رو به مسائل عقیدتی میپردازن
1288,7.666666666666667, در کل سختگیرن و هر درس یک مدلسازی و چهار مقاله میخواست که ریز بررسی میشه و در طول ترم هم مقداری از وقت رو به مسائل عقیدتی میپردازن
1289,8.666666666666666, از برخورد گرم و صمیمانه طول ترم انتظار نمیرفت که اینجوری نمره بدن، اطلاعات و شیوه بیان خوبی دارن مشکل نمره دادن بود
1290,9.166666666666666, خیلی خوش برخورد هستن در طول ترم یک ارائه میخوان و یک بار جواب دادن درس جلسه قبل یا به جاش در امتحان با یک سوال جبرانی اضافه (واقعا عالی)
1291,5.5, پیگیری و جدیت لازم رو ندارن و دانشجو به حال خودش میمونه و فقط کتاب رو در اختیار داره و به نظرم درس دادنشون خیلی معمولی بود
1292,10.0, استاد خوبی هستند هم از لحاظ اخلاق و رفتار و هم تدریس
1293,4.166666666666667, استادی هستن که اصلا نمیتونه درک کنه با تاخیر ۳ دقیقه ای میگه شما با تاخیر اومدید.
1294,4.5, استاد برای خودش درس میده و میره ، هیچی از جزوه بدخطش متوجه نمیشید، کلا با پسرا مشکل داره ترجیحا باهاش برندارید
1295,5.166666666666667, رو ۲۰ حساب کرده بودم ۱۵ داد ، باهاش برندارید ، نه حضور غیاب نه پروژه نه نهاد نه کنفرانس هیچی نمیده
1296,10.0, حتما باهاش بردارید اگر می خواهید معدل بالا داشته باشید
1297,10.0, اگر تمام تکالیفی که میگن رو براشون ایمیل کنی و هیچ غیبتی هم نداشته باشی به راحتی میتونید، بیست بگیرید.
1298,5.166666666666667, استادی که احترام دانشجو براش مهمه ولی خودش احترام چندانی به دانشجو نمیزاره.در کل بد نیست خوبم نیست .انتخاب دوم تون باشه
1299,10.0, استاد خیلی خیلی مهربون و با درکی هستن .بشدت احترام میزارن .حتما بردارید باهاشون
1300,8.0, حین درس دادن مکث زیاد میکنن و یکم سر کلاس شون خوابت میگیره اما استاد خوبی هستن
1301,1.0, فقط از پی دی اف روخونی میکنن و تمرین هارو حل نمیکنن و برحسب درست یا غلط بودن تمرین های حل شده دانشجو نمره میدن
1302,10.0, بهترین استاد بهایابی دانشگاه عالی تدریس میکنن عالی نمره میدن و کاملا مهمه که درس رو دانشجو بفهمه هر چه قدر هم سوال داشته باشید جواب میدن
1303,7.0, اخلاقش عالیه خیلی مهربون و خوش برخورد ولی تدرس خوبی ندارن اگه فیزیکتون ضعیفه برندارین بهتره
1304,9.333333333333334, یک سری سوالاتو مشخص میکنه که از چندتاشون تو امتحان میاره
1305,5.5, اگر میخواید نمره قبولی بگیرید حتمابایددر کلاس خیلی فعال باشیدنباشید  میوفتید این درسو شرکت در کلاس هم بصورت صحبت کردن با میکروفن هست
1306,10.0, استاد خوبیه حضور مهم نیست تو تلگرام کلاس و جزورو میزاره بخونید و پر کنید نمره خوبی میده
1307,10.0, خلاصه
1308,2.5, اگر میخواید نمره قبولی بگیرید حتمابایددر کلاس خیلی فعال باشیدنباشید  میوفتید این درسو شرکت در کلاس هم بصورت صحبت کردن با میکروفن هست
1309,3.1666666666666665, بنظرم باهاش برندارید چیز زیادی یاد نمیگیرید
1310,3.8333333333333335, تا جایی که میتونید اصلا با ایشون کلاس برندارید
1311,4.0, خیلی خوب نمره میدن ، ولی اصلااا‌ چیزی یاد نمیگیرید
1312,7.666666666666667, اگه فقط نمره براتون مهمه باهاش بردارید وگرنه چیز زیادی از کلاسش یاد‌ نمیگیرید
1313,9.833333333333334, کلاسشون خیلی سریع پر میشه به شدت مهربون و با محبت هستن خیلی بچه ها رو درک میکنن و خیلی با سواد هستن حتما باهاشون بردارین
1314,10.0, سخت گیر نیستن ولی باد کار کنید ، یادگیری توی بحث ها اتفاق میوفته ،کلاس روند متفاوت و خلاقی داره ، انتظارات عجیب غریب از دانشجو ندارن .
1315,9.333333333333334, خیلی استاد مهربونی هستن و دانشجو رو اذیت نمیکنن، اگه درسی رو ارائه دادن حتما بردارید
1316,2.3333333333333335, اگر استاد دیگه ای نبود بردارید
1317,9.666666666666666, استاد خوش اخلاقی هستند و دانشجو ها سر کلاس از درس لذت برده و اکثرا متوجه درس میشوند
1318,1.0, بد
1319,1.0, بد
1320,1.8333333333333333, فقط دوست داره نمره کم کنه***
1321,10.0, خیلی استاد خوبین حتما باهاشون بردارید و حرف هایی که دربارشون میگن رو باور نکنید
1322,10.0, خیلی استاد خوبین حتما با ایشون بردارید😍😍
1323,1.5, ایشون با اینکه عضو هئیت علمی دانشگاه هستن اما اصلا رفتار خوبی با دانشجو ها ندارن ***
1324,1.0, دررررس میپرسه از هر کی ۱۰_۱۵ دقیقه از چیزی که درست تدریس نکرده و تو بلد نیستی
1325,7.333333333333333, امتحان سخت/ شرايط امتحانو خودشم سخت كرد/ كتاب توي بازار موجود نبود هزينه پرينت خيلي زيادشد/ سعي در تحميل عقايد
1326,6.666666666666667, من با این استاد درس دستور زبان آلمانی داشتم
1327,10.0, خیلیا میگن استاده بدیه چون توقع بیجا ازش داشتن اگه باهاش راه بیایین خیلی استاده خوبیه
1328,10.0, عالیه !
1329,1.8333333333333333, بسیار سختگیر هستند و به هیچ وجه در رساندن مطالب به دانشجویان موفق نیستند و نمیشه نمره خوبی ازشون گرفت
1330,1.0, ۲۵۰ صفحه کتاب رو کامل باید بخونید هیچ سوالی نمیدن، امتحان وحشتناک سخت بود، آخرش هم ۹۰% کلاس رو انداخت، تحت هیچ شرایطی برندارید.
1331,5.333333333333333, *** در آخر ترم بعد از اومدن نمره ها شکه میشید. ....
1332,2.8333333333333335, از دانشجو بیگاری میکشه و واقعاااا بیش از حد کار میخواد
1333,10.0, استاد بسیار با اخلاق و مهربان
1334,10.0, بسیار استاد عالی و با اخلاق و هستن. دروس رو عالی درس میدن و هرجا مشکل داشته باشید حتما مشکلتون رو حل میکنن. واقعا حیفه باهاشون درس برنداشت.
1335,9.666666666666666, استاد خوبی هستن شاید به نظر یه کم بداخلاق بیان و اولش بترسید ولی واقعا اینطوری نیست فقط باید سر کلاسشون کاملا منظم و بادقت باشید
1336,8.833333333333334, فعالیت کلاسی رو با ارائه تحقیق سر کلاس ارزیابی میکنن
1337,10.0, از نظر سطح شعور بالاترین شعور و سواد را دارد
1338,2.3333333333333335, اصلا با این استاد درس برندارید ***
1339,1.0, از نظر اخلاقی بد نیست ولی نمره بالای ۱۷ رو فقط به خودشیرینا میده 
1340,10.0, بشدت مهربون وباسوادهستن تایادنگیرید ولتون نمیکنن!انرژی تدریس وارتباط انقدبالاست که انرژیتون نمیفته.از شاگرد ایشون بودن پشیمون نمیشید
1341,2.1666666666666665, کلاس برندارید با ایشون
1342,10.0, خیلی خیلی آدم حسابیه، رفیقه، اما خیلی خیلی قانونمند و منظم.
1343,5.166666666666667, نمره خوبی نمیشه ازشون گرفت بین دانشجوها فرق میزارن و موقع امتحان سخت میگیرن و زمان خیلی کمی رو نسبت به سوال های زیادی که میگن در نظر میگیرن
1344,10.0, استاد بسیار عالی ای هستن اگر علوم پایه دارید حتما با ایشون بردارین
1345,10.0, استاد خوبی هستن در طول ترم حتما با استاد پیش بیاید و جزوه بنویسید
1346,10.0, استاد اخر ترم ۴۰ تا سوال با جواب میده ک امتحان از همونه
1347,9.666666666666666, روی حضور حساسن سه بار حضور غیاب میکنن ولی خوش اخلاق هستن امتحان هم آسون و با ارفاق هست
1348,8.666666666666666, استاد خوبیه، این ترم هم که مجازی بود سرکلاسا نمیومد حضور و غیاب هم نمیکرد فقط فایل ضبط شده گذاشتن که بیشتر اوقات هم تکراری بود
1349,9.833333333333334, خیلی عالیه پیشنهاد میکنم حتما با ایشون بردارید.
1350,10.0, استاد فوق العاده عالی مهربان باشخصیت و کلاس درس اصلا خشک نیست درکل عالی
1351,8.666666666666666, کلاسشون خیلی جذاب نیست و چیزی برای یادگیری وجود نداره اما اخلاقا خوب و محترم هستن
1352,8.333333333333334, باحضور و کنفرانس وپروژه نمره کامل میگیرید اما اخلاقشون یذره تند و خاص هست
1353,6.5, یه خورده فعال باشی نمره خوبی میشه گرفت
1354,5.333333333333333, نيم ترم شفاهى دارن سوالاى امتحان تركيبي از كل كتاب تا جايي ك ميتونين ورندارين با ايشون
1355,9.833333333333334, حتما با ایشون بردارید،بسیار خوش برخورد وتمام تلاششون رو میکنن که هرجور شده به دانشجو کمک کنن و نمره خوبی بگیرن
1356,10.0, استاد خیلی خوبی هستن. علم کافی برای تدریس دارا هستند. خوش اخلاق و کلاسی با تبادل نظر جالب را اداره می‌کنند. درکل عالی
1357,10.0, استاده خیلی خوبیه تایم کلاس رو کامل درس میده خوش اخلاق و محترمه  تمرین هم میدن اگه حل کنید که تاثیر مثبت داره و حتما قبولید
1358,10.0, استاد خوبی و محترمی هستند. احترام دانشجو را محفوظ دارند.
1359,6.333333333333333, صرفا جهت نمره گرفتن توصیه میشن
1360,10.0, استاد بسیار خوبی هستن
1361,9.5, واقعا یکی از بهترین اساتید گروه کامپیوتر هستن. بسیار خوب درس میدن و بسیار خوب هم نمره میدن. حتما هرچی ارائه دادن بردارید.
1362,9.0, فوق العاده اطلاعات بالایی دارن و بسیار با شخصیت و مهربون هستن
1363,10.0, توی گروه بعد هر جلسه وویس اون جلسه رو میفرستنن که رو دور تند کلا ۲ ساعت وقت ادمو میگیره و امتحان بسیار آسونی داره و اذیت نمیکنه
1364,8.0, خیلی باسوادن ولی نمره خوبی نمیشه گرفت. ۲ تا میان‌ترم گرفتن و امتحان ترم خیلی سخت بود. احساس میکنم جمع نمره میان ترمو + ۸ کردن برای همه.
1365,10.0, یه پی‌دی‌اف ۲۰ صفحه‌ای قابل سرچ سوال میدن و دقیقا از همونا امتحان میگیرن. سریع هم نمره‌ها رو وارد سایت میکنن. عالین
1366,10.0, تمرینات هر هفته رو بهتره بفرستید نمره داره
1367,2.5, سعی کنید گزینه اخرتون باشه
1368,8.0, کلاس همه چیز داشت.تایم استراحت ، کوییز هرجلسه داشتیم ولی اصلا سخت نبود.
1369,2.6666666666666665, تدریس بصورت ویس هست و برای امتحان باید مثل یک جامعه شناس مقاله بنویسید😑
1370,9.666666666666666, امتحاناتشون حتی از سطح کتاب های مرجع بالاتر و سختر هست
1371,10.0, خیلی بد نمره میدن
1372,10.0, خیلی استاد خوبی هستند و کاملا بر درس مسلط هستند و بسیار روان و عالی تدریس می‌کنند 
1373,7.833333333333333, توصیه میکنم برای درس ریاضی مهندسی، اگر هیییچ استاد دیگه ای ارائه نداده بودن ، با ایشون بردارید.
1374,10.0, استاد خیلی خیلی خیلی خوبی هستن و پرانرژی و دوس داشتنی ، جزو استادهای دوست داشتنی و بسیار باسواد تهران مرکز هستن
1375,9.0, استاد خیلی خیلی خوبی هستن آخرترم هم ۲۰ تا سوال دادن برای امتحان کلی هم ارفاق کردن
1376,9.666666666666666, باید دوتا وبینار شرکت میکردیم و خلاصشو میفرستادیم در کل خیلی با دانشجو راه میان
1377,8.833333333333334, هر جلسه تحقیق میخواد و هر جلسه باید درباره تحقیقت صحبت کنی 
1378,1.8333333333333333, به هیچ عنوان باهاشون درس برندارید ، خیلی کمتر از اون چیزی که حقتونه نمره میدن
1379,10.0, استاد فوق العاده ای اند البته اگر خودتون اهل درس خوندن و کتاب خوندن هستید چون به عنوان پروژه ازتون خلاصه ی یک کتاب رو به صورت پاور میخوان
1380,9.833333333333334, خیلی استاد خوبین ولی همونقدر که نمره میدن ، براشون مهمه دانشجوها درس رو بخونند و پیگیر باشند
1381,3.3333333333333335, فن بیان بسیار پایین بود،یک منبع معرفی کردند که از توضیحات خودشون هم نامفهوم تر بود و خودشون از روی منبعی دیگر تدریس کردند !!!
1382,3.1666666666666665, از اون استادهایی اند که در ظاهر به فکر دانشجوها هستند ولی موقعی که نمره میاد میبینی که همش حرف بیخود بوده
1383,10.0, خیلی استاد خوبین کلی فعالیت میگن ک حتما بدردنمره امتحانتون میخوره عالی هستن حتما پیشنهاد میکنم
1384,10.0, درکل استادخوبین.حضوربسیارمهمه واسشون.اگه بیشتراز۴جلسه غیبت داشته باشین پاس نمیشین به گفته خودشون
1385,6.833333333333333, اصلاشرایط دانشجورودرک نمیکنن چندجلسه بخاطرمشکل دان نتونستم برم کلاس گفتن بهانه های دانشجویی زیاده.برای امتحان هم ۲تاسوال شفاهی پرسید
1386,6.166666666666667, به هیچ وجه باهاشون برندارید خیلی غیرمنصفانه نمره میدن حتی نمره خودتون هم نمیدن
1387,5.333333333333333, اصلا با این استاد بر ندارید با وجود فرستادن  تمرین ، یا مینداردتون یا با نمره پایین ۱۴ پاس میکنه
1388,2.8333333333333335, واقعا استاد مناسبی نیست،چون در طول کلا استرس و اضطراب به همه دانشجوو ها منتقل میکنند و نمره خودمون هم نمیدن
1389,10.0, خیلی رو حجم اطلاعات حساس ان، زیاد بنویسید و تحقیق کامل بدید
1390,9.666666666666666, ایشون از بهترین استادان تهران مرکز هستند
1391,1.0, به هيچ عنوان با اين استاد درس برنداريد حتي اگه ترم اخر بوديد
1392,10.0, واقعا جزو یکی از بهترین کلاساتون میشه اگر با ایشون واحد بردارید.
1393,5.666666666666667, دانشجو اصلا براشون اهمیت نداره، نه خود دانشجو نه زمانش، گاهی یک‌ساعت منتظرشون میموندیم تا بیان، کلا دانشجو رو خیلی حساب نمیکنن.
1394,4.833333333333333, اصلا این استاد برندارید نمره پایین میده
1395,10.0, امتحاناش عین عین جزوه‌اس،۵نمره میان ترم حذفی داره،حضورغیابم نمیکنه،راحت میشه باهاش ۲۰ شد
1396,10.0, استاد خوبین، باید ارائه بدید که روی ارائه خیلی حساسن و اگه ارائتون خوب باشه نمره خیلی خوبی‌ میگیرید
1397,9.833333333333334, استاد خوبی هست از نظر تدریس .
1398,10.0, استاد خوب و با حوصله ای هستن سوادشونم خوبه
1399,1.5, خیلی کلاسشون تو حاشیس به جایی اینکه درس بدن بیشتر به حواشی میپردازند اصلا با این استاد درس برندارید نمره از حقتون خیلی پایین تر میگیرید
1400,8.333333333333334, در طول ترم دوتا امتحان حذفی میگیرن در سطح متوسط و امتحان پایان ترم سخت ولی با ارفاق تصحیح میکنه و تدریس خوبه
1401,10.0, یعنی هر چی از خوبی این استاد بگم کمه😍 ماه ماه ماه عالیههههه شک نکنید هرچی ارائه داد بردارید
1402,9.833333333333334, امتحانشون فقط از جزوه نبود و باید سر کلاس هم کامل نت برداری بشه اما خب با ارفاق نمره میدن در کل خوب بودن
1403,1.3333333333333333, هرجور دوس داره نمره ميده كار كلاسي نداره فقط يه پرسش كلاسي داره و همش هم ميگه مسلط نيستي
1404,5.833333333333333, اصلا به حرف دانشجو گوش نمی‌ده وفقط حرف خودشو قبول داره
1405,6.833333333333333, استاد بدی نیستن فقط از لحاظ درس دادن ضعیف درس میدن تو مجازی که اینجوری بودن
1406,2.0, اصلا باهاش برندارید سر کلاسش خودش گفت نمیتونید از من نمره خوبی بگیرید اگه بتونید پاس کنید کمتر از ۱۴ میده
1407,10.0, بی نظیر هستن ، عالی هم نمره میدن ، یه تحقیق کوچیکم میدن که همه رو نمره کامل داد ، نمره‌ هم ۲ ۳ نمره بالاتر نمره خودت میده ، باهاش بردارید
1408,10.0, استاد خیلی خوبیه ،خیلی با بچه ها راه میاد،درک‌میکنه قشنگ دانشجوعارو،حتمااااا باهاش بردارین خیییییلی خوبه
1409,10.0, میشه گفت بهترین استاد حقوق جزا هستند هم خوب درس می‌دهند هم برای یادگیری دانشجو وقت می گذارند 
1410,10.0, نمره منصفانس الکی پاس نمیکنن ولی نمره گرفتن ازشون اصلا سخت نیست، باهاتون راه میان و زمان میدن تا بالاخره نمره رو بگیرین.
1411,3.1666666666666665, رفتار مناسبی سر کلاس ندارن
1412,8.5, نسبتا تدریس خوب، خیلی سختگیر روی امتحانا و تکالیف، روی قوانین حساس مثلا ایمیل دو دقیقه تاخیر نمیپذیرن
1413,7.333333333333333, تدریس خاصی نمیشه اگه فقط میخواید پاس کنید باهاشون بردارین
1414,4.333333333333333, اصلا اصلا اصلا باهاش کلاس بردارین
1415,1.0, میومد سر کلاس میخوابید تا اخر ترم حتی منبع امتحان هم نگفت آخر هم همرو اندخت و اگر هم اعتراض میزدی کتکت میزد
1416,10.0, خیلی استاد خوبی هستن اصلا دانشجو رو اذیت نمیکنن پیشنهاد میکنم حتما با این استاد درس انقلاب رو بردارید حرف ندارن
1417,7.833333333333333, پیشنهاد نمیشه اینکه میگن برای نمره خیلی خوبه ، نه نیس
1418,8.166666666666666, حضور غیاب نمیکنن همون چنددیقه اول اسکرین میگیرن ، استاد خوبین فقط نمیدونم چرا ترم خیلی بد نمره داد
1419,6.0, به نظرم حتی اگه مجبور شدین با این استاد بردارین بعدش حذف کنین واقعا اصلا نمره خوبی نمیدن و معدلتون میاد پایین
1420,5.5, خیلی استاد سخت گیری هست و تمام گزارش کارارو چک میکنه و امتحان بسیار سختی گرفت و نمرات بسیار پایین داد
1421,8.0, میگه حضور مهم نی ولی اگه غیبتا زیاد باشه گیر میده سوال بپرسه ندونی قاطی میکنه تو امتحان جوابا شبیه هم باشه نمره نمیده
1422,7.166666666666667, نمره ای که دادن چندان منصفانه نبود اما بد هم نبود. در کل استاد بدی نیستن
1423,9.833333333333334, استاد بسیار خوش اخلاق عالی حتما بردارید
1424,8.166666666666666, حتی اگر همه جلسات حاضر باشید و مثبتم بهتون بده نمره خوبی نمیده و هیچ فرقی با اون که کلاسو نرفته ندارید
1425,10.0, خیلی استاد خوبی هستن و راحت نمره کامل میگیرید
1426,8.666666666666666, حضور غیاب خیلی براشون مهمه. سر کلاس گاها از دانشجو سوال میپرسن که تاثیر داره. امتحانشون عینا از جزوس و راحته.
1427,9.333333333333334, استاد بسیار خوبی هستند و امتحانشون عینا از جزوس و آسونه.
1428,10.0, استاد بادرک و مهربونی هستن
1429,1.0, پنجاه درصد سرفصل هارو هم تموم نکردیم اشتباه زیاد علمی بین صحبتاشون و کتاب ها هست هیچ درسی نمیشه یاد گرفت
1430,2.0, باهاش برندارید
1431,9.5, ارائه میخاد ولی مهم نیست زیاد .مثبت میده .استاد خوبیه
1432,7.5, استاد بدی نبودن من شنیده بودم خیلی بده ولی اونقدرم بد نبود البته تکلیف و دو تا میانترم گرفت در اخر پاس کرد
1433,7.0, استاد خیلی خوب و با شخصیتی هستن اصلا اذیت نکرد در طول ترم البته از نظر زمانی خیلی بد و دائما کلاس وقفه داشت اما در اخر نمره نسبتا خوبی داد
1434,8.666666666666666, استاد خوبین اما این ترم خوب نمره ندادن چون ۸۰ درصد سوالاش عینا از جزوه بود انگار که امتحان عمومیه
1435,9.333333333333334, موقع ترم خودشون جزوه‌ میدن که از همون سوالا میاد، و تو طول ترم یک موضوع باید ارائه بدید .
1436,10.0, فوق العاده ترینننن استادی بودن که دیدم، حتماااااا برشون دارید 😍
1437,7.833333333333333, میان ترم میگیرن که یک سواله، و اگه کاری باهاشون نداشته باشید و چیزایی کا میخوادو انجام بدین نمره خوبو ازشون میشه گرفت، ترم هم مثل جزوه بود
1438,8.666666666666666, سر کلاس صدا ظبط شده بود، هر جلسه کوییز ۱ نمره ای داشتیم،کاملا منصفانه نمره خودتونو میدن
1439,9.166666666666666, در طول ترم موقع درس دادن تمرین حل میکردیم و مثبت میگرفتیم که مثبت ها تو نمره خیلی تاثیر داشت ، نمره هم یکم بالاتر از نمره خودتون میدن
1440,9.333333333333334, خیلی استاد خوبی هستن😍 حتما باهاشون بردارید با نمره ی عالی پاستون میکنن
1441,10.0, عالیه حتماً باهاشون بردارین
1442,10.0, فوق العادن ایشون حتما باهاشون بردارید بسیار باسواد و با شخصیت
1443,10.0, فعالیت درکلاس خیلی مهمه،اگر فعال باشید و به مطالب جزوه ای که خودشون میدن وتمرینای هالیدی رو کامل مسلط باشید
