,score,comment
2536,10.0, یه برنامه میگه نصب کنید داده ها رو بزنید نتیجه شو عکس بفرستید واسش مهمه
2537,10.0, تو درس ماشین الات در مورد موضوعات مرتبط به درس اگه ارائه داشته باشید خیلی به نمرتون کمک میکنه البته اختیاریه
2538,10.0, بهترین استاد هم خود خانوم پورجعفر هم همسر مهربانشون استاد دائمی عزیز  که فوت شدن متاسفانه
2539,10.0, استاد عالی هستن حتما باهاشون بردارید میخوان فعال باشید سرکلاس و محیط کلاس واقعا دوستانه اس عاشق استاد میشید انقدر که مهربونه
2540,10.0, استاد خیلی عالی هستن و حتما یه ذره بخونید نمره خوبی میگیرید از استاد هدایتی
2541,10.0, استاد خیلی خوبی هستن هر درسی اراعه دادن حتما بردارید 
2542,10.0, بهترینن این استاد😍😍حتما باهاشون بردارید هر جلسه سوال میگن که اخر ترم همون سوالا میاد
2543,1.0, اصلا با این استاد برندارید ترم مجازی باهاش داشتم 
2544,10.0, بهترین استاد برای دروس عمومی و معارف
2545,10.0, .
2546,9.833333333333334, به نظر یکی از بهترین اساتیدی بودن که داشتم استادی دقیق و بسیار محترم شیوه درس دادنشون عالیه اگر به نکاتشون دقت کنید نمره خوبی میگیرید
2547,10.0, استاد خوبی هستن 
2548,9.166666666666666, یکی از استادای با سواد و خوش برخورد این دانشگاه هستن😍حتما اگر تونستید با ایشون بردارید فوق العاده ان
2549,9.833333333333334, ایشون استاد خوبی هستن خیلی سخت گیر نیستن فقط یک کنفرانس میخوان و نمره خوبی هم میدن با خیال راحت باایشون درس بردارید
2550,2.5, بهتون پیشنهاد میکنم اگر که در هنرستان حسابداری نخوندید هرگز با ایشون  برندارید چون در حد ثبت زدن هم نمیتونن یادتون بدن
2551,7.5, استاد خوبیه به شرطی که تسلط کامل داشته باشی
2552,1.0, خیلی پشیمونم که باهاشون کلاس برداشتم با وجود پاورپوینتی که آماده کردم بهم ۱۲ داد .نمیدونم چرا بقیه نوشته بودن استاد خوبیه
2553,3.3333333333333335, توضیحات سرکلاس هیچ ارتباطی با درس و سوالات امتحان ندارد.
2554,8.166666666666666, امتحانشون تستی بود زیاد هم سخت نبود ولی حواستون به گزینه ها باید باشه چون گزینه های رد گم کنی هم بین سوالا بود
2555,10.0, امتحانش سخت نبود ۱۷ تا سوال بود که نصفش تستی بود یه متن هم داشت که با توجه به اون متن به سه تا سوال جواب میدادیم
2556,9.666666666666666, اگه تمرینایی که ازتون میخوان رو و باپروژه ای که براتون مشخص میکنن انجام بدین نمرتون خیلی خوب میشه 
2557,7.166666666666667, اصلا نمره خوبی نمیدن من تمام تکالیف براشون فرستادم برگمم کامل بود اما نمره افتضاح سرکلاس هم ویس ضبط شده برامون پخش میکردن با کلی تکلیف
2558,6.5, اصلا به هیچ کس نمره کامل گزارش کار نمیدن 
2559,10.0, بهترین استادی که تاحالا داشتم فوق‌العاده مهربان و با درک هستن و بدون نقص تدریس میکنن 
2560,10.0, بهترین استادی که تاحالا داشتم فوق‌العاده مهربان و با درک هستن و بدون نقص تدریس میکنن 
2561,7.666666666666667, خیلی استاد محترم و با اخلاقی هستن و نمره هم بد ندادن.
2562,10.0, استاد با شخصیت و باسوادی هستن.عالی درس میدن هرجارو هم نفهمی دوباره توضیح میدن.چنتا تمرین میدن تا جلسه بعد حل کنیم که مطلب برامون جابیوفته
2563,6.833333333333333, بیشتر تمرکزش روی وبیناراشه تا درسش ، در کل بد نیست
2564,5.166666666666667, نمره بالا مى ده  و اغلب كلاساشم با تا خير مياد برا افرادى كه دنبال يادگيرى هستند اصلا توصيه نمى كنم  اين استاد رو
2565,9.166666666666666, بسیار خوب تدریس میکنن ولی برای قسمت ازمایشگاه هر چقدر هم زحمت بکشی و گزارش کار تحویل بدی نمره درستی نمیده
2566,1.8333333333333333, .وقت امتحان خيلي خيلي كم هست.نمره رو خيلي پايين تر از نمره ي خودت ميده .تا جايي كه مي تونيد باهاشون كلاس نگيريد
2567,10.0, استاد خوبی هستن ولی پایان ترم 🤲 ... اره خلاصه 😬
2568,4.333333333333333, اصلا استاد خوبی نیست
2569,8.833333333333334, خیلی استاد خوبی هستن حتما باهاشون بردارید
2570,7.5, خیلی استاد مودی هستش یه روز خوبه یه روز بد 
2571,9.0, خیلی استاد خوب و مهربونی هستش حتما باهاش بردارید
2572,5.5, کلا باهاش برندارید
2573,5.0, صدای ضبط شده میزاره خودش میره
2574,10.0, بسیار عالی، خوش برخورد، با معلومات و خیلی مهربون. دانشجو را درک میکنند، فیزیک را با این استاد میشه یادگرفت. بهترین استادی بود که داشتم.
2575,5.833333333333333, توصیه میکنم اگه برات نمرت مهم نیست باهاشون بردارید و اگر حرف های تخریب کننده استاد براتون اهمیت نداره
2576,10.0, فوق العادس
2577,10.0, بهمن 99
2578,5.666666666666667, یک کتاب معرفی میکند و فصل به فصل با روخوانی پیش میرود
2579,8.0, استاد مهربون و باشخصیت هستن ولی متاسفانه آموزش طراحی نمیدن بلکه تمرین میدن برای کپی کردن و بعد دوره چیزی به شما اضافه نمیشه
2580,6.0, چند جلسه درس میدن بقیه ترمو بچه ها کنفرانس میدن. اگربارعلمی کلاس مهمه براتون پیشنهادنمیکنم ولی خب خوب نمره میدن (با کنفرانس و تمرین ها)
2581,8.5, تحقیق میگه بهتون با کنفرانس که انجام بدی بهتره ندی هم 20 را میده...یه 20 بدون دردسر
2582,9.0, استاد نیازی هر هفته کوییز میگرن و تمرین زیاد میدن و نمره داره به شدت به فعالیت اهمیت میدن ولی اذیت نمیکنن.ولی خیلی کلاس خشک و خسته کنندس
2583,10.0, استاد خیلی خوبیه و همرو با نمرات بالای ۱۷ قبول میکنه
2584,10.0, در یک کلام بهترین استاد ❤️ رفتار دوستانه ای دارن و خیلی مهربان هستن کلاسشون هم خیلی شاد هست و شوخ هستن خوش میگذره
2585,9.666666666666666, استاد بسیار مهربون و صبوری هستن حتما واحد با ایشون بردارید
2586,10.0, بهترین استاد دنیا. واقعا بینظیره
2587,10.0, بسیار مهربان تدریس عالی فعال باشید سر کلاس بهترین نمره رو میگیرید کسی بد میگه توجه نکنید مشکل از خودشون بود اگر نه استاد بهترین هستن
2588,8.0, اخلاقش خاصه، ولی اگر درسخون و علاقمند به فارسی هستید استاد مناسبیه
2589,5.833333333333333, اگه نمره کامل براتون مهمه با این استاد برندارین .چون تو کل جلسات کلا ۲ بار اومدن و اخر هم از خودشون رندوم  نمره دادن وگفتن به هیچکس ۲۰ نمیدن
2590,9.833333333333334, کلاسهاشون در تلگرام و بصورت فایل ویس و جزوه برگذار میشه با دانشجو هم راه میان
2591,9.5, استاد فهمیده و خوش برخوردی هستند با دانشجو هم کنار میان
2592,9.833333333333334, بسیار استاد باسواد و خوش برخوردی هستند
2593,3.8333333333333335, متاسفانه ارتباط بسیار بدی با دانشجو دارند و غرور بیجایی دارند در کلاس هم جزوه ای رو مثل انشا روخوانی می کنند که سوالات از همون جزوه میاد
2594,1.0, امتحانش سخت و بر اساس شماره دانشجویی درس روخونی میکنه همه رو هم میندازه فقط ممگنه ۳ نفر بالای ۱۲ بشن!
2595,4.166666666666667, ترمی که باهاش داری خداکمکت کنه به هیچ صراطی مستقیم نیست بهترین نمره که میشه ازش گرفت۱۵متاسفانه درسای تخصصی کلا زیردستشه کاری نمیشه کرد
2596,4.166666666666667, ترمی که باهاش داری خداکمکت کنه به هیچ صراطی مستقیم نیست بهترین نمره که میشه ازش گرفت۱۵متاسفانه درسای تخصصی کلا زیردستشه کاری نمیشه کرد
2597,7.5, اخلاق خیلی خوبی نداره
2598,10.0, استاد با سواد، خوش رفتار و خوش صحبت هستند‌. دست خط افتضاحی دارند. تا از فهمیدن دانشجو مطمئن نشن درس رو پیش نمیبرن. حتما با ایشون بردارید.
2599,3.1666666666666665, آداب و رفتار این استاد با توجه به اینکه روانشناس هستند اصلا درست نیست با دانشجویان و بسیار سر کلاس جیغ میزنه
2600,7.5, سرکلاس بلافاصله بعد از تدریس میپرسه روش نمره دادنو اخر ترم عوض کرد تازه استاد شده تنها ضعف کارش اینه که از رو مرجع انگلیسی درس میده
2601,10.0, اگر میخواید دروس ریاضی مخصوصا ریاضی مهندسی با نمره خوب پاس بشید بهترین استاد و بقیه انتخاب بین بد و بدترین هاست
2602,4.666666666666667, استاد بدی نیستن اما نمره کم میدن
2603,4.666666666666667, بیشتر سوال هایی که در امتحان میاد از تمرین هایی که در کتابش هست اگه کتاب رو تهیه کنید و سر کلاس فعال باشید پاس میشید
2604,10.0, بهترین استادی که وجود داره. اگه واسه نمره میای ۲۰ی اگه واسه درس میای خیلی باسواده خیلی احترام میزاره از ثانیه های اول خنده درجریانه تا اخر
2605,5.5, اخر ترم به گروه های ۳ یا ۴ نفره تقسیم میکنند که باید یه پروژه ای که خودشون تو کلاس تعیین میکنند رو برای ایشون ارسال کنید
2606,9.5, خیلی سرکلاس عالین وخوب، اما امتحانشون به شدددت وقت گیره
2607,8.166666666666666, حضور غیاب نمیکنن و پایان ترم چنتا سوال مشخص میکنن از همونا سوال میاد من 20 شدم.
2608,10.0, امتحان پایان ترم را از سوال و جواب آخر هر درس که توی پی دی افی که می دهند هست
2609,10.0, عااااااااالی
2610,10.0, برای منع تقلب شماره دانشجویی میزارن جای اعداد و یک امتحان شفاهی هم میگیرن از تمریناتی که حل کردید در کل سختگیرن و تعدادی نمره کامل گرفتند
2611,6.666666666666667, میانترم 8 نمره(قسمت حد سخت میگیرن با ایده مشابه در جزوه) پایان ترم 12نمره(اکثرا جزوه)
2612,7.166666666666667, تمرینای جزوش میاد راحت پاس میشید سوالا سادن ولی انتظار یادگیری ازشون نباشه چون ویس میگیرن تو کانال میزارن که جالب نیس
2613,6.0, سوالات حل شده در کلاس ابتدایی و ساده هستند ولی در امتحان سطح سختی سوالات تعجب بر انگیز است. ترجیحا انتخاب آخر باشند
2614,1.0, باهاش برندارید،اعصاب نمیزاره،نمره نمیده،منفی پشت منفی
2615,3.5, پیشنهاد میکنم اصلا با این استاد برندارید هیچی از درس نمی‌فهمین
2616,10.0, حضور فعال سر کلاس براشون مهمه و نمره داره
2617,8.833333333333334, استاد سوادشون خیلی خوبه 
2618,10.0, بهترین استاد دنیاست
2619,10.0, دکتر یزدی بهترینه❤️ از همه نظر علمش بالاست. هر جلسه پروژه خلاقانه میخواد (پاور ویدیو پادکست) ک بعضیا سختشونه ولی با مهارت میشین
2620,7.5, آیتم هایی رو برای ایمیل زدن بهشون میگن که خیلی براشون مهمه اگر حضور داشته باشید و نکات ایمیل رو رعایت کنید نمره خوبی میگیرید
2621,10.0, كلا نيم ساعت مياد سركلاس  نمره هم به همه بالامى ده  برا درس عمومى خيلى عاليه اين استاد
2622,3.0, عالی نمره میده ولی اصلا چیزی یاد نمیگیری ، کلا مودیه یه روز خوبه یه روز رفتارش بد
2623,2.3333333333333335, اصلا به دانشجو احترام نمیزاره و خیلی دانشجو رو اذیت میکنه ، درس دادنشم اصلا خوب نیس ‌چیزی یاد نمیگیری جز تعریف کردن از خودش. ا
2624,9.0, اگر دانشجوی درسخونی هستی حتما با ایشون بردار👍🏻
2625,1.0, به هیچ وجه با ایشون برندارید
2626,7.333333333333333, اگه ميخواين نمره كامل بگيرين بايد خيلي درسشونو بخونيد يكم سختگيرن ولي استاد بدي نيستن
2627,6.166666666666667, خیلی کمتر از نمره خودتون میگیرید من کامل ورقه نوشتم ۱۴ دادن
2628,4.666666666666667, استاد به ظاهر مهربون و خوب هست ولی برای امتحان سوال خارج از کتاب میده و همه باید یه کنفرانس بدن در طول ترم و نمره خوبی نمیده
2629,10.0, سوال ميده از همونا امتحان ميگيره
2630,10.0, خيلي استاده مهربونيه
2631,10.0, سوال ميده از همونا امتحان ميگيره فقط بديش اينكه نمره خيلي زير وارد ميكنه
2632,10.0, استاد به ظاهر سخت گيرين چند بار حضور غياب ميكنن 
2633,10.0, واقعن مهربونن بهترين استادن تمرين كه ميگن بفرستي 
2634,1.0, اصلا باهاش برندارییدددددد
2635,3.0, طرز برخورد با دانشجو در واتساپ مناسب نیست
2636,3.6666666666666665, خیلی بین دخترا وپسرا فرق میزاشتن و با پسرها خیلی اکی تر بودن و همیشه ازکارهای پسراتعریف میکردن و اصلا انگارا دخترا توی کلاس وجود نداشتن!
2637,9.666666666666666, ۲ تا امتحان میان ترم میگیره ولی اون مباحث حذف میشن برای پایان ترم. سوالات عین خود جزوه‌ست نمره هم خوب میده
2638,5.333333333333333, جزوه کافیه واسه امتحان ولی مشکل اینجاس طی ترم اصلا توضیح نمیده و نمیتونه مطلب رو برسونه به دانشجو که یاد بگیره و آخر ترم با جزوه پاس بشه
2639,4.166666666666667, استادی به شدت بد اخلاق هستن و نمره خوبی نمیدن
2640,8.833333333333334," نمرده دادنشون بستگی به روحیاتشون داره ... اگه پرسش و پاسخ جواب ندین در طی چند جلسه , آخر ترم نمره خوبی به کل کلاس نمیدن !!!"
2641,7.833333333333333, تسلط استاد روی مباحث خیلی خوبه اما یکمی به جو کلاس اهمیت نمیدن. درکل میشه گفت استاد خوبی هستن ولی عالی هم نیستن.
2642,10.0, خیلی با معرفته و دوست داشتنی یک یک هست رو دست نداره
2643,1.0, کلادنبال یه چیزی میگردن تابالحن بدمقابل همه رفتار کنندکمبود بچه‌گیاشون رو دردانشگاه خالی میکنند.اگر نمرتون مهمه باهاش برندارید
2644,1.0, فقط جیغ میزنه یه پروژه سخت خیلی سختدر حدی که باید بهشون یاداوری شه ما کارشناسی هستیم نه دکترا نمره خوبی نمیدن اصلا با ۱۲ پاس میکنن
2645,1.0, اگر به صورت حرفه ای هم پروژشون رو تحویل بدید ۱۰ میدن اگه کارنامت برات مهمه باهاش برندار چون حقت رو نمیده
2646,9.333333333333334, بسیار استاد خوب و با دانشی هستند و با اینکه درس عمومی تدریس میکنند کلاس جذابی دارند. 
2647,10.0, بهترین استاد😍😍😍
2648,10.0, استاد پناهی واقعا مهربون و با شخصیت هستن و خیلیم خوب درس میدن .تو کلاس فعال باشید وامتحان از جزوه خودشون حتما بیست میشید
2649,9.0, استاد خوبی هستند. در زبان تخصصی امتحان از سوالات بعد از متن کتاب هست بدون اینکه خود متن را بدهند. امتحانشون سخت وغیر مرتبط به زبان است.
2650,8.166666666666666, برای یادگیری برنامه نویسی اصلا توصیه نمیشه 
2651,9.166666666666666, استاد خوش اخلاق و با شعوری هستند و با دانشجویان برخورد خوب و پاسخگویی مناسبی دارند.
2652,7.666666666666667, تقریباً متوجه نمیشین ایشون چی درس میدن چون تعدد منابع + کتب خودشون رو دارن و فقط میخونن و رد میشن
2653,8.333333333333334, حضور غیاب مهم و از تمام لحظات کلاس استفاده میکنن. اهمیت بیشتری به دختر ها می‌دهند.
2654,8.333333333333334, فقط اینکه حتما باید برای این درس ارائه بدید
2655,7.833333333333333, خیلی سختگیره بالاترین نمره ازایشون ۱۴ هست خیلی ریز بین صحیح میکنه برگه هارو
2656,5.166666666666667, تو دان نمیاد و تو واتس اپ وویس میفرسه
2657,3.6666666666666665, خیلی با خنده اکثرا دانشجو هارو میندازه 
2658,10.0, خیلی باسواد،مسلط،منظم و دلسوزن.یادگیری ما براشون مهمه.روی تخته درس میدن.نظم و فعالیت مهمه.اولین گزینه برای تحقیق۱و۲ هستن
2659,2.0, کلاسا مجازی بود صداشون اصلا واضح نبود 
2660,10.0, خوب درس میدن اما خیلی سخت گیری الکی داره جواب هارو‌ خیلی سخت تصحیح میکنه از نمره خودتون کمتر میده
2661,9.666666666666666, استاد خوبین در کل اگه تمرینا رو براش بفرستید تاثیر میده ولی امتحاناش سخت تر از جزوش بود
2662,10.0, جای چت کردن تو گروه ها بشنید جزوه بنویسید گوش بدیددرسو تا موقع امتخان لنگ نمونید
2663,5.166666666666667, توصیه میکنم این استادو اصلا انتخاب نکنین.آخر ترم امتحانش خیلی سخته و اصلا با جزوه ای که میده شباهت نداره و کلی فرق داره.
2664,3.6666666666666665, استاد سخت گیری هستن و درسهای جلسه قبل رو اکثر جلسات میکروفن باز میکنن و میپرسن
2665,8.166666666666666, اگر نمره میخواید با این استاد بردارید در غیر این صورت برای یادگیری درس بهتره با استاد دیگه‌ایی بردارید
2666,10.0, استاد خیلی باسواد و محترمین
2667,9.5, کلاسشون تایمش نیم ساعته استاد خوبی هستند ولی یکم نا مفهوم صحبت میکنند
2668,10.0, واقعا استاد خبی هستند
2669,9.833333333333334, تمرین زیاد می‌دهند پروژه هم زیاد میدهند میانترم میگیرند 
2670,10.0, بهترین استاد هستند بسیار مهربون و تدریس عالی و فعال باشی نمره عالی میدن❤️
2671,9.666666666666666, اگر دنبال یادگیری هستین استاد خوبیه.اگر نمره میخواین حتما نمره۲۰ و۱۹نمیده
2672,8.833333333333334, تنها نکته منفیی ک دیدم اشتباهی بود سر نمره دادن به چند دانشجو بابت تقلب کردن ک دانشجویی ک تقلب نکرده بود11شد و متقلبا همه بالای17
2673,10.0, بسیار مهربان و خوش صحبت و دلسوز.نهاد و یه کنفرانس ۳ دقیقه ای به صورت وویس انجام میدین.نمونه سوال میدن واز همونا امتحان
2674,10.0, برخوردشون عالیه ومحترمانه
2675,10.0, خیلی استاد مهربون و خوبین. وقتی جزوه میگن که بنویسین خودشون میگن که چه چیزایی مهمه و تو امتحان میاد.
2676,6.666666666666667, اگر برا یادگیری میخواید برندارید اما اگر بلدید و فقط میخواید پاس بشید باهاتون راه میان
2677,4.166666666666667, سعی کنید برندارید چون کلاس بینهایت خشک هستش مخصوصا مجازی، اصلا صفحه چت رو چک نمیکنن سوال جواب نمیدن حضور داری اما غایب میزنن.
2678,8.333333333333334, این استاد خیلی بار علمی قوی دارند ولی برای نمره گرفتن گزینه مناسبی نیستند بهرحال باید مشارکت داشته باشید حین تدریس
2679,8.0, استاد خیلی خوبی هستن و کلاسشون اصلا خشک نیست اگر سوالی دارید بپرسید تا باحوصله جوابتونو بدن ولی بنظرم از خود درس چیزی دستگیرتون  نمیشه
2680,1.8333333333333333, اگه مجبور هم بودید با این استاد برندارید چون آخر ترم میبینید که با نمره زیر ۱۰ افتادید
2681,10.0, بهترین استاد که دیدم
2682,9.0, اگر دانشجو ادب رو رعایت نکنه مقابله میکنن در غیر این صورت بسیار استاد خوبی هستن و اگر همه ی جلسات رو حضور داشته باشید نمره ۲۰ ازشون میگیرید
2683,1.6666666666666667, با این برندارید. اینقدر آدم عقده ای هستن که هشتاد درصد بچه هارو انداختن
2684,10.0, خیلی خوبه . محترم هستند.
2685,8.333333333333334, استاد خوب و با شخصیتی هست
2686,8.166666666666666, درصورتی که درسو بخونید و تمریناشو انجام بدید حتی با ۲۰ام پاس میشید استادی نیست که مفت نمره بده
2687,10.0, بسیاد استاد خوبی هستند و کنفرانس هم میخوان ولی سخت نمیگیرن
2688,2.1666666666666665, سر کلاس باید همش صحبت کرد نمره خوبی هم نمیدن چیزی نمیشه یادگرفت برای پاس کردن و یادگیری برندارین
2689,2.6666666666666665, اصلا خوب نیست جواب سوال مارو نمیدادن.انگار صدا ضبط شده میذاشتن میرفتن.صدا قطع میشد اصلا توجه نمیکردن.امتحان هم سخت بود 20تا تست توی 30دقیقه
2690,10.0, فوق العاده هستن
2691,10.0, ادب و احترام به کلاس و اهمیت به درس براشون مهمه
2692,3.3333333333333335, اگه براتون مهمه درس یاد بگیرین با این استاد برندارین
2693,9.0, استاد سخت گيري هستن.هرجلسه كار كلاسي ميده و طبق همون ها نمره آخر ترم رو ميده . امتحان پايان ترم ما فقط ٤ نمره بود
2694,10.0, خیلی استاد خوبین هم نمره خوب میدن و هم یاد میگیرین بهترین استاد😍🤩
2695,7.333333333333333, تنها چیز منفی اینه که خیلی تکلیف میدن و امتحان میگیرن وگرنه من هر دو ترم ۱۸ شدم
2696,10.0, The best teacher of the university 🌷
